{
  "schemaVersion": 1,
  "rules": "2014",
  "weightPolicy": "adjusted-lb",
  "files": [
    "data/items/general-store/containers.json",
    "data/items/general-store/fire-lighting.json",
    "data/items/general-store/rope-climbing.json",
    "data/items/general-store/camping.json",
    "data/items/general-store/writing.json",
    "data/items/general-store/household.json",
    "data/items/general-store/animal.json",
    "data/items/general-store/travel.json",
    "data/items/general-store/tools.json",
    "data/items/general-store/trade-goods.json",
    "data/items/tavern/ale.json",
    "data/items/tavern/beer.json",
    "data/items/tavern/mead.json",
    "data/items/tavern/wine.json",
    "data/items/tavern/spirits.json",
    "data/items/tavern/non-alcoholic-drinks.json",
    "data/items/tavern/hot-drinks.json",
    "data/items/tavern/breakfast.json",
    "data/items/tavern/lunch.json",
    "data/items/tavern/dinner.json",
    "data/items/tavern/stews.json",
    "data/items/tavern/roasts.json",
    "data/items/tavern/bread.json",
    "data/items/tavern/cheese.json",
    "data/items/tavern/desserts.json",
    "data/items/tavern/snacks.json",
    "data/items/tavern/travel-meals.json",
    "data/items/tavern/luxury-meals.json",
    "data/items/tavern/animal-feed.json",
    "data/items/tavern/imported-drinks.json",
    "data/items/tavern/soups.json",
    "data/items/tavern/fish.json",
    "data/items/tavern/tavern-supplies.json",
    "data/items/blacksmith/ammunition.json",
    "data/items/blacksmith/heavy-armour.json",
    "data/items/blacksmith/light-armour.json",
    "data/items/blacksmith/martial-weapons.json",
    "data/items/blacksmith/medium-armour.json",
    "data/items/blacksmith/shields.json",
    "data/items/blacksmith/simple-weapons.json",
    "data/items/blacksmith/tools.json",
    "data/items/blacksmith/trade-goods.json",
    "data/items/alchemist/potions.json",
    "data/items/alchemist/herbs.json",
    "data/items/alchemist/ingredients.json",
    "data/items/alchemist/reagents.json",
    "data/items/alchemist/glassware.json",
    "data/items/alchemist/alchemical-tools.json",
    "data/items/fence/disguises.json",
    "data/items/fence/forgery.json",
    "data/items/fence/burglary-tools.json",
    "data/items/fence/poisons.json",
    "data/items/fence/smuggling.json",
    "data/items/fence/contraband.json",
    "data/items/fence/stolen-goods.json",
    "data/items/fence/curiosities.json",
    "data/items/fence/rare-components.json",
    "data/items/general-store/core-equipment.json",
    "data/items/general-store/adventuring-equipment.json"
  ],
  "shops": [
    "tavern",
    "general-store",
    "alchemist",
    "blacksmith",
    "black-market"
  ],
  "categories": [
    "containers",
    "fire-lighting",
    "rope-climbing",
    "camping",
    "writing",
    "household",
    "animal",
    "travel",
    "tools",
    "clothing",
    "trade-goods",
    "food",
    "drink",
    "alchemical-goods",
    "weapons",
    "armour",
    "contraband",
    "ale",
    "beer",
    "mead",
    "wine",
    "spirits",
    "non-alcoholic-drinks",
    "hot-drinks",
    "breakfast",
    "lunch",
    "dinner",
    "stews",
    "roasts",
    "bread",
    "cheese",
    "desserts",
    "snacks",
    "travel-meals",
    "luxury-meals",
    "animal-feed",
    "imported-drinks",
    "soups",
    "fish",
    "tavern-supplies",
    "simple-weapons",
    "martial-weapons",
    "light-armour",
    "medium-armour",
    "heavy-armour",
    "shields",
    "ammunition",
    "potions",
    "herbs",
    "ingredients",
    "reagents",
    "glassware",
    "alchemical-tools",
    "disguises",
    "forgery",
    "burglary-tools",
    "poisons",
    "smuggling",
    "stolen-goods",
    "curiosities",
    "rare-components",
    "spellcasting-supplies"
  ],
  "deferredFiles": []
}
